filename,title,text,len
01-Contract Law For Dummies.pdf,01-Contract Law For Dummies,"Contract Law\nFOR \nDUMmIES‰\nby Scott J. Burnham  \nwith Joe KraynakContract Law\nFOR \nDUMmIES‰\nContract Law For Dummies®\nPublished by  \nJohn Wiley & Sons, Inc.  \n111 River St.  \nHoboken, NJ 07030-5774  \nwww.wiley.com\nCopyright © 2012 by John Wiley & Sons, Inc., Hoboken, New Jersey\nPublished simultaneously in Canada\nNo part of this publication may be reproduced, stored in a retrieval system or transmitted in any form or \nby any means, electronic, mechanical, photocopying, recording, scanning or otherwise, except as permit -\nted under Sections 107 or 108 of the 1976 United States Copyright Act, without the prior written permis -\nsion of the Publisher. Requests to the Publisher for permission should be addressed to the Permissions \nDepartment, John Wiley & Sons, Inc., 111 River Street, Hoboken, NJ 07030, (201) 748-6011, fax (201) 748-\n6008, or online at http://www.wiley.com/go/permissions .\nTrademarks:  Wiley, the Wiley logo, For Dummies, the Dummies Man logo, A Reference for the Rest of Us!, \nThe Dummies Way, Dummies Daily, The Fun and Easy Way, Dummies.com, Making Everything Easier, and \nrelated trade dress are trademarks or registered trademarks of John Wiley & Sons, Inc., and/or its affili -\nates in the United States and other countries, and may not be used without written permission. All other \ntrademarks are the property of their respective owners. John Wiley & Sons, Inc., is not associated with \nany product or vendor mentioned in this book.\nLIMIT OF LIABILITY/DISCLAIMER OF WARRANTY: THE PUBLISHER AND THE AUTHOR MAKE NO \nREPRESENTATIONS OR WARRANTIES WITH RESPECT TO THE ACCURACY OR COMPLETENESS OF \nTHE CONTENTS OF THIS WORK AND SPECIFICALLY DISCLAIM ALL WARRANTIES, INCLUDING WITH -\nOUT LIMITATION WARRANTIES OF FITNESS FOR A PARTICULAR PURPOSE. NO WARRANTY MAY BE \nCREATED OR EXTENDED BY SALES OR PROMOTIONAL MATERIALS. THE ADVICE AND STRATEGIES \nCONTAINED HEREIN MAY NOT BE SUITABLE FOR EVERY SITUATION. THIS WORK IS SOLD WITH THE \nUNDERSTANDING THAT THE PUBLISHER IS NOT ENGAGED IN RENDERING LEGAL, ACCOUNTING, OR \nOTHER PROFESSIONAL SERVICES. IF PROFESSIONAL ASSISTANCE IS REQUIRED, THE SERVICES OF \nA COMPETENT PROFESSIONAL PERSON SHOULD BE SOUGHT. NEITHER THE PUBLISHER NOR THE \nAUTHOR SHALL BE LIABLE FOR DAMAGES ARISING HEREFROM. THE FACT THAT AN ORGANIZA -\nTION OR WEBSITE IS REFERRED TO IN THIS WORK AS A CITATION AND/OR A POTENTIAL SOURCE \nOF FURTHER INFORMATION DOES NOT MEAN THAT THE AUTHOR OR THE PUBLISHER ENDORSES \nTHE INFORMATION THE ORGANIZATION OR WEBSITE MAY PROVIDE OR RECOMMENDATIONS IT \nMAY MAKE. FURTHER, READERS SHOULD BE AWARE THAT INTERNET WEBSITES LISTED IN THIS \nWORK MAY HAVE CHANGED OR DISAPPEARED BETWEEN WHEN THIS WORK WAS WRITTEN AND \nWHEN IT IS READ.\nFor general information on our other products and services, please contact our Customer Care \nDepartment within the U.S. at 877-762-2974, outside the U.S. at 317-572-3993, or fax 317-572-4002.\nFor technical support, please visit www.wiley.com/techsupport .\nWiley publishes in a variety of print and electronic formats and by print-on-demand. Some material \nincluded with standard print versions of this book may not be included in e-books or in print-on-demand. \nIf this book refers to media such as a CD or DVD that is not included in the version you purchased, you \nmay download this material at http://booksupport.wiley.com . For more information about Wiley \nproducts, visit www.wiley.com .\nLibrary of Congress Control Number:\nISBN 978-1-118-09273-6 (pbk); ISBN 978-1-118-19555-0 (ebk); ISBN 978-1-118-19544-4 (ebk);  \nISBN 978-1-118-19547-5 (ebk)\nManufactured in the United States of America\n10   9   8   7   6   5   4   3   2   1",3704
02-About the Author.pdf,02-About the Author,"About the Author\nScott J. Burnham,  a graduate of New York University School of Law, is the \nCurley Professor of Commercial Law at Gonzaga University School of Law in \nSpokane, Washington. For 30 years, he has taught Contracts at law schools \nthroughout the U.S. and internationally. As a practicing lawyer and consultant \non contract matters, he has a good sense of the practical application of  \ncontracts principles, and as a prolific writer on legal topics, he has the ability \nto convey those principles with clarity.",529
03-Dedication.pdf,03-Dedication,,0
04-Authors Acknowledgments.pdf,04-Authors Acknowledgments,"Dedication\nTo everyone who studies contract law — may you grow to love her as much \nas I do!\nAuthor’s Acknowledgments\nThanks to acquisitions editors Michael Lewis and David Lutton, who chose \nme to author this book and ironed out all the preliminary details to make it \npossible, and to Larry Garvin, who recommended me for the gig.\nElizabeth Rea, my project editor, deserves a loud cheer for serving as a gifted \nand patient collaborator and editor — shuffling chapters back and forth, \nshepherding the text and graphics through production, making sure any \ntechnical issues were properly resolved, and serving as the unofficial  \nquality control manager. Copy editor Danielle Voirol earns the editor of the \nyear award for ferreting out my typos, misspellings, grammatical errors, and \nother language foe paws (or is it faux pas?), in addition to assisting Elizabeth \nas reader advocate. I also tip my hat to the Composition crew for doing such \nan outstanding job of transforming my text and graphics into such an attractive \nbook. My deepest thanks go to wordsmith Joe Kraynak, who was able to  \nsuccessfully blend my knowledge of Contracts with his knowledge of writing.\nPublisher’s Acknowledgments\nWe’re proud of this book; please send us your comments at http://dummies.custhelp.com . \nFor other comments, please contact our Customer Care Department within the U.S. at 877-762-2974, \noutside the U.S. at 317-572-3993, or fax 317-572-4002.\nSome of the people who helped bring this book to market include the following:\nAcquisitions, Editorial, and  \nVertical Websites\nProject Editor:  Elizabeth Rea\nAcquisitions Editor:  Michael Lewis\nSenior Copy Editor:  Danielle Voirol\nDevelopment Editor:  Joe Kraynak\nAssistant Editor:  David Lutton\nEditorial Program Coordinator:  Joe Niesen\nTechnical Editors: James P. Nehf,  \nJeremy Telman\nEditorial Manager: Michelle Hacker\nEditorial Assistant:  Alexa Koschier\nCover Photo: © iStockphoto.com/Pali Rao\nCartoons: Rich Tennant  \n(www.the5thwave.com )Composition Services\nProject Coordinator: Nikki Gee\nLayout and Graphics: Joyce Haughey,  \nChristin Swinford, Laura Westhuis\nProofreaders: Melissa Cossell,  \nBonnie Mikkelson\nIndexer: Valerie Haynes Perry\nPublishing and Editorial for Consumer Dummies\nKathleen Nebenhaus, Vice President and Executive Publisher\nKristin Ferguson-Wagstaffe, Product Development Director\nEnsley Eikenburg,  Associate Publisher, Travel\nKelly Regan,  Editorial Director, Travel\nPublishing for Technology Dummies\nAndy Cummings,  Vice President and Publisher\nComposition Services\nDebbie Stailey,  Director of Composition Services",2649
05-Contents at a Glance.pdf,05-Contents at a Glance,"Contents at a Glance\nIntroduction  ................................................................ 1\nPart I : Introducing Contract Law and Contract Formation  ...7\nChapter 1 : Getting the Lowdown on Contract Law  ....................................................... 9\nChapter 2 : Let’s Make a Deal: Offer and Acceptance  .................................................. 23\nChapter 3 : Sealing the Deal: The Doctrine of Consideration  ...................................... 45\nChapter 4 : Noting Exceptions: Promises Enforceable without a Contract  ............... 63\nPart II : Determining Whether a Contract  \nIs Void, Voidable, or Unenforceable  ............................. 77\nChapter 5 : Introducing Contract Defenses  ................................................................... 79\nChapter 6 : Considering Whether an Agreement Is  \nUnenforceable Due to Illegality or Unfairness  ........................................................... 89\nChapter 7 : Evaluating the Parties’ Ability to Make the Contract  ............................. 105\nChapter 8 : Assessing the Enforceability of Oral Agreements  .................................. 119\nPart III : Analyzing Contract Terms and Their Meaning  ....135\nChapter 9 : Evaluating Unwritten Terms with the Parol Evidence Rule  .................. 137\nChapter 10 : Finding Unwritten Terms That Complete the Contract  ....................... 151\nChapter 11 : Interpreting Contracts  ............................................................................. 169\nPart IV : Performing the Contract or Breaching It  ........ 183\nChapter 12 : Evaluating Whether Contract Modifications Are Enforceable  ............ 185\nChapter 13 : Deciding Whether Unforeseen Events Excuse Performance  ............... 201\nChapter 14 : Checking for Conditional Language ........................................................ 213\nChapter 15 : Breaching the Contract by Anticipatory Repudiation  ......................... 235\nPart V : Exploring Remedies for Breach of Contract  .....247\nChapter 16 : Examining How Courts Handle Breach of Contract  ............................. 249\nChapter 17 : Exploring Remedies in Article 2 of the UCC  .......................................... 267\nChapter 18 : Checking for Additional Remedies  ......................................................... 285\nPart VI : Bringing Third Parties into the Picture  .......... 303\nChapter 19 : Deciding Whether a Third Party Can  \nEnforce or Interfere with a Contract  ......................................................................... 305\nChapter 20 : Acknowledging the Rights and Duties of Third Parties  ........................ 315\nPart VII : The Part of Tens  ......................................... 325\nChapter 21 : Ten Questions to Ask When Analyzing a Contracts Problem  ............. 327\nChapter 22 : Ten Notable People (And Philosophies) in Contract Law  ................... 337\nAppendix : Glossary  .................................................. 341\nIndex  ...................................................................... 345",3115
