filename,title,text,len
33-The Doctrine of Restitution Creating an Obligation to Prevent Unjust Enrichment.pdf,33-The Doctrine of Restitution Creating an Obligation to Prevent Unjust Enrichment,"71  Chapter 4: Noting Exceptions: Promises Enforceable without a Contract\nThe court found that although no contract was formed, the franchisees had \nacted in reasonable reliance on these promises and were able to recover for \ntheir losses. Note, however, that even though setting up a franchise is a busi -\nness deal with a lot of money at stake, the franchisee has very little bargaining \npower and may, for this purpose, be considered an unsophisticated party.\nRemembering that reliance doesn’t  \nusually qualify as acceptance\n Reliance isn’t a viable fallback option when an offeree fails to accept an offer. \nYou have to accept an offer, not simply rely on it, to make it enforceable.\n For example, suppose I offer you 10,000 pens for $10,000, and you don’t express \nacceptance. Minutes later, you decide to open a pen store. You rent space at \nthe local mall and sink some money into advertising. You show up at my door, \nand before you have a chance to utter a word, I say, “I revoke my offer.”\nI successfully exercised my right to revoke the offer at any time before accep -\ntance. You may say, “But I relied  on your offer,” as evidenced by renting office \nspace and taking out advertising, but I would assert, and the courts would \nagree, that you shouldn’t have relied on the offer; you should’ve accepted it \nby promising to pay me the $10,000 I had requested.\nNote the difference between a promise and an offer. By presenting an offer I \nmade a promise, but as an offer, it called for acceptance and consideration — \nin this case, your promise to pay me $10,000. You knew you had to accept the \noffer, not rely on it, to make it enforceable. If you wanted some time to think \nit over, you should’ve entered into an option contract by paying me a consid -\neration to keep my offer open (see Chapter 2 for details).\nThe Doctrine of Restitution: Creating an \nObligation to Prevent Unjust Enrichment\nContract law is always on the watch for anything that seems unfair, including \nunjust enrichment  — when one party unfairly gains a benefit at another party’s \nexpense. To prevent or mitigate unjust enrichment, the courts rely on the doc -\ntrine of restitution,  doing whatever’s required to compensate both parties fairly \nor return them to their original positions prior to their dispute. This section \nreveals how the courts use restitution to deal with unjust enrichment.\n72 Part I: Introducing Contract Law and Contract Formation \nBattling unjust enrichment with  \nthe implied-in-law contract\nOne tool the courts use to prevent unjust enrichment is the implied-in-law \ncontract,  or quasi (pseudo)  contract — an obligation the law imposes on the \nparties when the parties haven’t entered into a formal agreement.\nAn implied-in-law contract must meet the following three conditions:\n ✓ Services must not be performed as a gift.\n ✓ Services cannot be forced on a party.\n ✓ The obligation formed by the implied-in-law contract must prevent \nunjust enrichment.\n Don’t confuse the implied-in-law  contract with the implied-in-fact  contract. An \nimplied-in-fact contract is a real contract (that is, a bargained-for contract) \nfound in the conduct of the parties rather than in their words (see Chapter 2). \nAn implied-in-law contract is not a bargained-for contract but an obligation \nbased on restitution.\n The classic example of an implied-in-law contract occurs when a doctor renders \nemergency medical services to a comatose patient and then bills the patient for \nthose services. The patient may emerge from the coma and say something like, \n“Too bad, but I never agreed to pay for those services.” However, contract law \nwould likely side with the doctor to prevent unjust enrichment — the patient’s \nreceiving medical treatment without giving the doctor anything in return. \nSomeone may claim that the treatment was forced on the patient, but the courts \nwould argue otherwise, stating that any reasonable person in the doctor’s \nshoes would’ve concluded that had the patient been conscious, he would’ve \nrequested the services and is therefore obligated to pay.\nOn the other hand, if I mow your lawn without your asking me to do so and \nthen claim that I conferred a benefit on you for which you should compen -\nsate me, the law would say that my act was officious  — performed without \nyour consent — in which case you’re not obligated to pay for it. Society \ndoesn’t want businesses to go around forcing people to accept services and \nthen demanding payment.\n Although the reasonable value of services in a particular situation is not \nalways clear, reasonable value of the benefit conferred is always the starting \npoint for measuring the recovery in restitution.\n73  Chapter 4: Noting Exceptions: Promises Enforceable without a Contract\nAwarding restitution for saving a life?\nA restitution issue arises when one person \nclaims that another has a “moral obligation” \nto pay for a benefit conferred. Today people \ntry to stick to looking at legal obligations, but \nthe legacy of past cases remains. In Webb v. \nMcGowin,  a 1923 Alabama case, Webb, an \nemployee of McGowin, was in the process of \nthrowing a block and tackle (rope and pulley \nsystem) from a loft when he saw his employer, \nMcGowin, moving directly into the path of the \nfalling object. To save McGowin from injury, \nWebb threw himself at the falling block and \ntackle, diverting it so it missed McGowin, but \nseverely injuring himself in the process. In \nthose days workers’ compensation was non -\nexistent, but McGowin promised to pay Webb \n$15 every two weeks for the rest of Webb’s life. \nMcGowin made the payments until he died five \nyears later. When the executor of his estate \nrefused to continue the payments, claiming the \nestate had no contractual obligation to make \nthem, Webb sued.\nWebb had a lot of sympathy going for him but \nnot a lot of law. Obviously McGowin and Webb \nhad no bargained-for contract. Nor did Webb \nrely on the promise by McGowin; he had already \nacted before the promise was made. What \nabout “moral obligation” — does McGowin \nhave an obligation to pay Webb for a benefit \nconferred, even though the law didn’t require \nit? Today the courts would say no, because \nthey’re concerned only with legal obligations.\nBut what about restitution — didn’t Webb \nconfer a benefit on McGowin? One problem with \nthe restitution claim in this case is that society \ngenerally thinks that a person who saves some -\none’s life or commits a similar heroic act has \nconferred a gift on the person and is not entitled \nto compensation. Society honors heroes for their courage and sacrifice but doesn’t allow \nthem to recover from the person they saved. In \nthis case, however, McGowin promised to pay \nWebb. Does a promise by the person saved take \nwhat was otherwise a gift and change it into an \nenforceable promise? Maybe. For one thing, the \npromise makes the act appear less like a gift, \nbecause people generally don’t offer to pay for \ngifts. For another, because the recovery in res -\ntitution is the value of the benefit conferred, the \npromise puts a value on the act that otherwise \nwould be difficult to determine.\nIn this case, the court held that a contract was \nformed. That seems like nonsense to me, but it \nmay make sense to say that a promise in a situ -\nation like this is enforced as a kind of restitution \nwhere the value of the benefit conferred can’t \nbe determined. The result of the case has been \ncaptured in Restatement § 86, the principles of \nwhich can be summarized in the context of res -\ntitution as the following:\n ✓ If a benefit conferred is not a gift and not \nofficious, then the party who was unjustly \nenriched must pay the value of the benefit \nconferred. If the party who received the \nbenefit made a subsequent promise to pay, \nthe amount promised is irrelevant because \nthe claim is in restitution, not contract.\n ✓ If a benefit is conferred as a gift, as in the \ncase of most rescues, then neither claim in \nrestitution nor promise to enforce in con -\ntract is present.\n ✓ If a benefit is conferred and the person \nwho received the benefit made a subse -\nquent promise to pay, even if no claim in \nrestitution would exist, the promise may be \nenforceable in contract to the extent nec -\nessary to prevent injustice.\n74 Part I: Introducing Contract Law and Contract Formation \n Apparently in the good old days, doctors commonly set fees based on each \npatient’s ability to pay. In one particular case, after rendering services on an \nunconscious person, a doctor discovered that the person was very wealthy \nand sent him an inflated bill. The court held that the doctor and patient \ncould’ve contracted for that amount, but when the claim is based on an \nimplied-in-law contract, the measure of the recovery is the value of the  \nbenefit conferred rather than what the contract price would’ve been.\nDetermining when a court is likely  \nto find unjust enrichment\nWhenever one party confers a benefit on another that’s not a gift and not offi -\ncious (forced upon the recipient), then look to a claim based in restitution. \nCourts commonly award restitution when parties enter a contract and then \none of the parties successfully asserts a contract defense that destroys the \nclaim that the parties made a bargain (see Part II for info on contract defenses); \nthe court then tries to restore the parties to their positions prior to contract \nformation. In doing so, the court employs the principle of restitution.\n For example, if I orally agree to buy your house for $100,000 and give you a \ndown payment of $5,000, you may correctly claim that our contract is not \nenforceable because it was oral. (As I explain in Chapter 7, all real estate con -\ntracts must be evidenced by a writing.) You win that particular battle, but now \nyou have $5,000 of my money that I didn’t hand you as a gift nor confer on you \nofficiously, so I ought to get it back. Because we have no contract, the proper \nclaim is in restitution — you keep your house, and I get my $5,000 back.\nSorting out restitution in a material breach\nThe restitution issue arises when a party can’t make a contract claim because \nshe’s materially breached the contract. (A material breach  is any failure by the \nbreaching party that’s significant enough to give the injured party the right \nnot to perform his part of the contract.) In such cases, the court may compel \nthe injured party to provide restitution in an amount equal to the benefit that \nthe breaching party conferred on the injured party. (See Chapter 14 for more \nabout material breach.)\n For example, suppose I hire a contractor to build a house for me for $200,000. \nThe contractor builds 40 percent of the house and then stops. Obviously, the \ncontractor can’t recover from me on the contract because he’s completed so \nlittle of the project. That’s a material breach.\n75  Chapter 4: Noting Exceptions: Promises Enforceable without a Contract\nBut I did receive a benefit. Hiring another contractor to finish building the \nhouse may cost me only $120,000. Should I get to keep the benefit conferred \nby the dirty contract-breaker without paying for it? Authority is split on this \nquestion, but the modern view is to allow the party who breaches a contract \nto recover in restitution for the benefit conferred. In this case, the courts \nwould likely order me to pay the first contractor $80,000. The contrary view \nis that he has committed a wrong, and a wrongdoer should not be able to \nmake an equitable claim.\nOf course, because the contractor is in the wrong, my recovering my expec -\ntancy damages (putting me where I would’ve been had the contract been \nperformed) takes priority over his getting restitution. If he claimed that he \nspent $100,000 building the house before he quit and completing it cost me \n$120,000, he gets only $80,000 in restitution because I’m entitled to get what I \nbargained for — the house for $200,000.\n76 Part I: Introducing Contract Law and Contract Formation",12163
34-Part II Determining Whether a Contract Is Void Voidable or Unenforceable.pdf,34-Part II Determining Whether a Contract Is Void Voidable or Unenforceable,"Part II\nDetermining Whether a \nContract Is Void, Voidable, \nor Unenforceable\nIn this part . . .\nF \nreedom of contract is the most basic principle  \ngoverning contract law. It gives everyone of legal age \nand sound mind the freedom to bargain fairly for contracts \nallowable by law. In certain situations, however, a person \nmay appear to have freely entered into a contract when \nshe really didn’t. In such cases, the person can challenge \ncontract formation or try to avoid the contract by  \nlaunching a contract defense.\nThe chapters in this part explore common contract \ndefenses, which arise from illegal contracts, contracts \ncontrary to public policy, unconscionable terms, lack of \ncapacity, fraud, duress and undue influence, mistake, and \nthe statute of frauds.",788
35-Chapter 5 Introducing Contract Defenses.pdf,35-Chapter 5 Introducing Contract Defenses,,0
36-Leveraging the Power of Policies.pdf,36-Leveraging the Power of Policies,"Chapter 5\nIntroducing Contract Defenses\nIn This Chapter\n▶ Appreciating contract law policies\n▶ Understanding the legislature’s role in regulating contracts\n▶ Understanding the courts’ role in policing contracts and interpreting statutes\n▶ Looking into affirmative defenses\nA \n contract defense  is a challenge to a contract’s formation and enforce -\nability. For example, suppose you’re a plaintiff trying to get a court to \nenforce a contract you think I’ve breached. You present your case and prove \nwe formed a contract through offer, acceptance, and consideration (see \nPart I of the book for details). Even so, the contract isn’t necessarily valid or \nenforceable. I have the opportunity to present a contract defense — to offer \nproof claiming that certain facts undermine the contract’s formation and \ndestroy its enforceability.\nThese facts typically have less to do with the three elements of contract for -\nmation (offer, acceptance, and consideration) and more to do with policies \nadopted by courts and regulations enacted by federal or state legislatures. \nThis chapter introduces and explains these policies and regulations so you’re \nbetter equipped to challenge a contract’s validity or defeat that challenge. \nThe remaining chapters in this part focus on specific policies and regulations \nthat influence decisions in contract cases.\nLeveraging the Power of Policies\n Contract law has four key policies that guide the courts in deciding whether \ncontracts or terms are enforceable by law:\n ✓ Freedom of contract\n ✓ Efficiency\n ✓ Fairness\n ✓ Predictability\n80 Part II: Determining Whether a Contract Is Void, Voidable, or Unenforceable \nNo single policy takes precedence over another in all cases. In fact, contract \nlaw is often an attempt to reconcile competing policies. As an attorney, you \ncan use this idea to your client’s advantage, as long as you understand the dif -\nferent policies and how the courts are likely to reconcile competing policies.\nFreedom of contract\nFreedom of contract is the most basic principle governing contract law. It \ngives everyone of legal age and ability the freedom to bargain fairly for con -\ntracts allowable by law.\nAll other things being equal, freedom of contract rules the roost. If two par -\nties agree to a deal that passes the formation requirements (which I outline \nin Part I), it’s enforceable in a court of law. However, the law has the power \nto scrutinize the agreement to make sure that nothing about it is illegal or \nunfair. If a deal is lopsided enough, a court may inquire into it based on the \nprinciple of fairness.\n As you explore the various devices courts use to overturn agreements, \nremember that freedom of contract includes the freedom to make a bad deal. \nIf nothing’s wrong with the transaction other than the fact that one party \nagreed to sell something for a lot less than it’s worth, the law should let the \nagreement stand.\nEfficiency\nThe principle of efficiency facilitates the free and fair exchange of goods \nand services. Generally, freedom of contract ensures economic efficiency, \nbecause parties freely bargain for what they want to get out of the transac -\ntion. The assumption is that each party agrees only to what’s in her best \ninterest. But if one party engages in certain conduct that takes advantage \nof the other party (unfair conduct), the efficiency of the transaction may be \nimpaired, both in terms of economics and justice.\nYou need to look at efficiency both in terms of freedom of contract and fair -\nness. If I have a car worth $10,000 and I agree to sell it to you for $100, an \neconomist may say the deal was efficient because $100 had more utility than \nthe car had for me and obviously the car had more efficiency than your $100 \nhad for you. On the other hand, inquiring minds want to know whether such \na deal is fair: Something seems fishy about the transaction. Why would I sell  \na $10,000 car for $100? Was something illegal going on? Did you hold a gun  \nto my head and make me agree? Was I out of my mind at the time? These \nfacts would show that the agreement wasn’t economically efficient because  \nI wasn’t able to maximize my interests.",4233
37-Making the Most of Statutes.pdf,37-Making the Most of Statutes,"81  Chapter 5: Introducing Contract Defenses\nFairness\nThe principle of fairness is designed to keep one party from making a sucker \nof the other, perhaps by slipping terms into the contract that are unfavorable \nto the other party or that the other party is unlikely to read or understand.\nOf course, you can’t merely claim that a contract or term is unfair; you must \nfashion a legal argument that indicates precisely what’s offensive about the \ntransaction. Chapter 6 exposes you to contract practices and terms deemed \nillegal or unfair to assist you in gauging the legality, fairness, and enforceabil -\nity of a contract and its terms.\nPredictability\nThe principle of predictability facilitates contract planning. It provides every -\none involved in contract law with the secure knowledge that if you enter into \na transaction in a particular way or use certain words, then the outcome is \nthe same as it has been in the past. Courts generally follow this rule, which \ngoes by the Latin name of stare decisis,  which means “let the decision stand.”\nBut different contract cases arise under different facts, and a court may apply \na rule to one set of facts that it doesn’t apply to another set of facts. As a \nresult, contract law isn’t always as predictable as most people want it to be.\n For example, what level of quality can the buyer of a used car expect? Assume \nan automobile wholesaler sells a car to a used-car lot, the used-car dealer sells \nthat car to a consumer, and the buyer sells the car to a friend. The transac -\ntions involve the sale of the same car, but in the first transaction, the parties \nare sophisticated commercial parties; in the second, they’re a sophisticated \ncommercial party and a consumer; and in the third, they’re two unsophisti -\ncated parties. In these different circumstances, you can’t assume that a court \nwill apply the same rule in the same way.\nMaking the Most of Statutes\nContract law has two layers: common law and statutes. Common law  is \nany collection of laws established by prior judicial decisions (precedents). \nStatutes,  which federal and state legislatures have the power to pass, govern \nparticular transactions. These statutes may clarify, reinforce, or override the \ncommon law, so when you’re dealing with a contract defense, you need to be \naware of statutes that may be relevant to the defense.\n82 Part II: Determining Whether a Contract Is Void, Voidable, or Unenforceable \nIn this section, I explain how the authority of federal and state statutes differ \nand provide general guidance on how to make strategic use of these statutes \nto bring a contract claim.\nProtecting consumers with  \nstate and federal statutes\nContract law is traditionally state law. The federal government may \nget involved, however, because Congress has the authority under the \nConstitution to regulate interstate commerce, and many contracts involve \ninterstate transactions.\n Both federal and state legislatures have been active in enacting statutes that \napply to a consumer transaction  — a transaction that an individual enters into \nwith a business for personal, family, or household purposes. Here are a few \nexample transactions to help you tell whether you’re dealing with a consumer \ntransaction or something else:\n ✓ Consumer transaction:  You buy a car from a dealer. The dealer is a  \nbusiness, and you’re a consumer.\n ✓ Business-to-business transaction:  A used-car dealer buys a car from a \ndistributor. No consumer is involved, so it’s not a consumer transaction.\n ✓ Peer-to-peer transaction:  I buy a used car from you. In most jurisdic -\ntions, this doesn’t constitute a consumer transaction because neither \nparty is a business.\nFederal and state statutes are primarily for consumer protection, but they \ndiffer in the types of protection they afford consumers, as I explain next.\nThe Federal Trade Commission (FTC) Act\nThe United States Congress passed the Federal Trade Commission (FTC) Act \nin 1914. The FTC Act very broadly forbids “unfair or deceptive acts or prac -\ntices” in interstate trade and commerce. Over the years, the FTC has adopted \nrules and guidelines that list the acts and practices the FTC considers unfair \nor deceptive for various industries.\nFor example, the FTC discovered that used-car dealers frequently made false \nor misleading statements about the condition of the cars they were selling \nand the warranties buyers were getting. As a result, the FTC now requires \nused-car dealers to put a sticker on the window of each car that clearly dis -\ncloses whether any warranty is provided, and if so, what it covers.\nThe FTC is primarily a consumer protection agency. Consumers may file \ncomplaints with the FTC to seek justice, but the FTC is likely to pursue only \n83  Chapter 5: Introducing Contract Defenses\nthe most significant claims. For individual recovery, consumers may need to \npursue a claim under the state law.\nState statutes\nAlthough the FTC can bring a complaint on behalf of a consumer, an individ -\nual doesn’t have a private right of action,  meaning that he can’t bring his own \nclaim under the FTC Act. Every state has solved this problem by enacting its \nown Consumer Protection Act that operates like a mini–FTC Act. Under the \nstate statutes, both a state agency and the consumer can bring a complaint. \nIn fact, in most jurisdictions, attorneys have an incentive to help consumers \nbring these claims, because if they’re successful, they can collect attorney’s \nfees from the losing defendant. (You may not appreciate that now, but you \nwill when you get into practice!)\nThe principal statute you encounter in contract law is Uniform Commercial \nCode (UCC) Article 2, which applies to the sales of goods. Most UCC provi -\nsions are not regulatory; they’re default rules  that apply in the absence of \nrules in the parties’ agreement.\n Most of the provisions of UCC Article 2 apply to transactions involving the \nsale of goods, regardless of whether the parties are merchants. Nevertheless, \na court may well apply a section differently depending on whether the trans -\naction involves two sophisticated parties, a sophisticated party and an unso -\nphisticated party, or two unsophisticated parties.\nContract law in the U.S. Constitution\nThe United States Constitution has little to \nsay about contracts. The Contract Clause — \nArticle I, Section 10, Clause 1 — provides that \n“No state shall . . . pass any . . . Law Impairing \nthe Obligation of Contracts.” Although that may \nsound like the law should let people contract \nas they please, courts have applied the clause \nmuch more narrowly. The drafters were appar -\nently concerned about a widespread prac -\ntice under the old Articles of Confederation \nwhereby states would relieve individuals of \ntheir obligation to pay debts, particularly debts \nto foreign creditors.\nIn modern times, parties to contracts have chal -\nlenged the constitutionality of state regulations \nthat affect their contracts. The Supreme Court laid out a three-part test for whether a law vio -\nlates the Contract Clause in Energy Reserves \nGroup v. Kansas Power & Light , 459 U.S. 400 \n(1983). It allows the state to interfere with free -\ndom of contract if\n ✓ The state regulation does not substantially \nimpair a contractual relationship.\n ✓ The state has “a significant and legitimate \npurpose behind the regulation, such as the \nremedying of a broad and general social or \neconomic problem.”\n ✓ The law is reasonable and appropriate for \nits intended purpose.\nMost regulations have no problem overcoming \nthese hurdles and trump freedom of contract.",7718
